{
 "schema_version": 2,
 "module_id": "c1-r108",
 "run_id": 108,
 "drafted_at": "2000-01-01T00:00:00Z",
 "source_module": {
  "path": "../modules/module-c1-r108.json",
  "sha256": "6081c515b2cd7e0fb7711b53320956d5a06003c2559ea8c91dfbcce456c84f11",
  "question_digest": "b96e375c3a08c698670a704c5528c727262fc5b959641bdb2eb0155b220dc9be"
 },
 "tier1_corpus": [
  {
   "source_id": "DEMO-1-1-SLIDES",
   "path": "tests/fixtures/curriculum/Block A/Week 1.1 Demo/Lectures/slides.md",
   "kind": "slides"
  },
  {
   "source_id": "DEMO-1-1-TRANSCRIPT",
   "path": "tests/fixtures/curriculum/Block A/Week 1.1 Demo/Lectures/transcript.vtt",
   "kind": "transcript"
  },
  {
   "source_id": "DEMO-1-1-ILO",
   "path": "tests/fixtures/curriculum/ILO.md",
   "kind": "ilo"
  }
 ],
 "items": [
  {
   "item_id": "p1-11",
   "status": "drafted",
   "segments": [
    {
     "kind": "claim",
     "text": "The fictional source describes the cap and duct in detail.",
     "provenance_refs": [
      "p1"
     ]
    },
    {
     "kind": "claim",
     "text": "The cited draft selects its initial position.",
     "provenance_refs": [
      "p1"
     ]
    }
   ],
   "provenance": [
    {
     "ref": "p1",
     "tier": 1,
     "source_id": "DEMO-1-1-SLIDES",
     "locator": "slide 2",
     "tag": "[T1:DEMO-1-1-SLIDES:slide 2]"
    }
   ],
   "confidence": "high",
   "proposed_selection": [
    "o1"
   ]
  },
  {
   "item_id": "p1-12",
   "status": "drafted",
   "segments": [
    {
     "kind": "claim",
     "text": "The fictional source describes the cap and duct in detail.",
     "provenance_refs": [
      "p1"
     ]
    },
    {
     "kind": "claim",
     "text": "The cited draft selects its initial position.",
     "provenance_refs": [
      "p1"
     ]
    }
   ],
   "provenance": [
    {
     "ref": "p1",
     "tier": 1,
     "source_id": "DEMO-1-1-SLIDES",
     "locator": "slide 2",
     "tag": "[T1:DEMO-1-1-SLIDES:slide 2]"
    }
   ],
   "confidence": "high",
   "label_placements": [
    {
     "label": "Oram",
     "target": "Cap",
     "target_index": 0
    },
    {
     "label": "Tessin",
     "target": "Cap",
     "target_index": 0
    }
   ]
  },
  {
   "item_id": "p1-13",
   "status": "drafted",
   "segments": [
    {
     "kind": "claim",
     "text": "The fictional source describes the cap and duct in detail.",
     "provenance_refs": [
      "p1"
     ]
    },
    {
     "kind": "claim",
     "text": "The cited draft selects its initial position.",
     "provenance_refs": [
      "p1"
     ]
    }
   ],
   "provenance": [
    {
     "ref": "p1",
     "tier": 1,
     "source_id": "DEMO-1-1-SLIDES",
     "locator": "slide 2",
     "tag": "[T1:DEMO-1-1-SLIDES:slide 2]"
    }
   ],
   "confidence": "high",
   "proposed_selection": [
    "o1",
    "o2"
   ]
  },
  {
   "item_id": "p1-14",
   "status": "drafted",
   "segments": [
    {
     "kind": "claim",
     "text": "The fictional source describes the cap and duct in detail.",
     "provenance_refs": [
      "p1"
     ]
    },
    {
     "kind": "claim",
     "text": "The cited draft selects its initial position.",
     "provenance_refs": [
      "p1"
     ]
    }
   ],
   "provenance": [
    {
     "ref": "p1",
     "tier": 1,
     "source_id": "DEMO-1-1-SLIDES",
     "locator": "slide 2",
     "tag": "[T1:DEMO-1-1-SLIDES:slide 2]"
    }
   ],
   "confidence": "high",
   "label_placements": [
    {
     "label": "A",
     "target": "label 0, anchor 0 at 10.0% across, 50.0% down"
    },
    {
     "label": "B",
     "target": "label 1, anchor 1 at 25.0% across, 50.0% down"
    },
    {
     "label": "C",
     "target": "label 2, anchor 2 at 40.0% across, 50.0% down"
    },
    {
     "label": "D",
     "target": "label 3, anchor 3 at 55.0% across, 50.0% down"
    },
    {
     "label": "E",
     "target": "label 4, anchor 4 at 70.0% across, 50.0% down"
    }
   ]
  },
  {
   "item_id": "p1-15",
   "status": "drafted",
   "segments": [
    {
     "kind": "claim",
     "text": "The fictional source describes the cap and duct in detail.",
     "provenance_refs": [
      "p1"
     ]
    },
    {
     "kind": "claim",
     "text": "The cited draft selects its initial position.",
     "provenance_refs": [
      "p1"
     ]
    }
   ],
   "provenance": [
    {
     "ref": "p1",
     "tier": 1,
     "source_id": "DEMO-1-1-SLIDES",
     "locator": "slide 2",
     "tag": "[T1:DEMO-1-1-SLIDES:slide 2]"
    }
   ],
   "confidence": "high",
   "label_placements": [
    {
     "label": "Cap",
     "target": "label 0, anchor 0 at 10.0% across, 50.0% down"
    },
    {
     "label": "Duct",
     "target": "label 1, anchor 1 at 25.0% across, 50.0% down"
    }
   ]
  },
  {
   "item_id": "p1-16",
   "status": "drafted",
   "segments": [
    {
     "kind": "claim",
     "text": "The fictional source describes the cap and duct in detail.",
     "provenance_refs": [
      "p1"
     ]
    },
    {
     "kind": "claim",
     "text": "The cited draft selects its initial position.",
     "provenance_refs": [
      "p1"
     ]
    }
   ],
   "provenance": [
    {
     "ref": "p1",
     "tier": 1,
     "source_id": "DEMO-1-1-SLIDES",
     "locator": "slide 2",
     "tag": "[T1:DEMO-1-1-SLIDES:slide 2]"
    }
   ],
   "confidence": "high",
   "label_placements": [
    {
     "label": "A",
     "target": "Cap",
     "target_index": 0
    },
    {
     "label": "B",
     "target": "Cap",
     "target_index": 0
    }
   ]
  },
  {
   "item_id": "p1-17",
   "status": "drafted",
   "segments": [
    {
     "kind": "claim",
     "text": "The fictional source describes the cap and duct in detail.",
     "provenance_refs": [
      "p1"
     ]
    },
    {
     "kind": "claim",
     "text": "The cited draft selects its initial position.",
     "provenance_refs": [
      "p1"
     ]
    }
   ],
   "provenance": [
    {
     "ref": "p1",
     "tier": 1,
     "source_id": "DEMO-1-1-SLIDES",
     "locator": "slide 2",
     "tag": "[T1:DEMO-1-1-SLIDES:slide 2]"
    }
   ],
   "confidence": "high",
   "label_placements": [
    {
     "label": "Same",
     "target": "label 0, anchor 0 at 10.0% across, 50.0% down"
    },
    {
     "label": "Same",
     "target": "label 1, anchor 1 at 25.0% across, 50.0% down"
    }
   ]
  },
  {
   "item_id": "p1-18",
   "status": "skipped",
   "skip_reason": "user-excluded"
  },
  {
   "item_id": "p2-21",
   "status": "skipped",
   "skip_reason": "user-excluded"
  },
  {
   "item_id": "p2-22",
   "status": "skipped",
   "skip_reason": "user-excluded"
  },
  {
   "item_id": "p2-23",
   "status": "skipped",
   "skip_reason": "user-excluded"
  },
  {
   "item_id": "p3-31",
   "status": "drafted",
   "segments": [
    {
     "kind": "claim",
     "text": "The fictional source describes the cap and duct in detail.",
     "provenance_refs": [
      "p1"
     ]
    },
    {
     "kind": "claim",
     "text": "The cited draft selects its initial position.",
     "provenance_refs": [
      "p1"
     ]
    }
   ],
   "provenance": [
    {
     "ref": "p1",
     "tier": 1,
     "source_id": "DEMO-1-1-SLIDES",
     "locator": "slide 2",
     "tag": "[T1:DEMO-1-1-SLIDES:slide 2]"
    }
   ],
   "confidence": "high",
   "proposed_selection": [
    "o1"
   ]
  },
  {
   "item_id": "p3-32",
   "status": "drafted",
   "segments": [
    {
     "kind": "claim",
     "text": "The fictional source describes the cap and duct in detail.",
     "provenance_refs": [
      "p1"
     ]
    },
    {
     "kind": "claim",
     "text": "The cited draft selects its initial position.",
     "provenance_refs": [
      "p1"
     ]
    }
   ],
   "provenance": [
    {
     "ref": "p1",
     "tier": 1,
     "source_id": "DEMO-1-1-SLIDES",
     "locator": "slide 2",
     "tag": "[T1:DEMO-1-1-SLIDES:slide 2]"
    }
   ],
   "confidence": "high",
   "proposed_selection": [
    "o1"
   ]
  },
  {
   "item_id": "p3-33",
   "status": "drafted",
   "segments": [
    {
     "kind": "claim",
     "text": "The fictional source describes the cap and duct in detail.",
     "provenance_refs": [
      "p1"
     ]
    },
    {
     "kind": "claim",
     "text": "The cited draft selects its initial position.",
     "provenance_refs": [
      "p1"
     ]
    }
   ],
   "provenance": [
    {
     "ref": "p1",
     "tier": 1,
     "source_id": "DEMO-1-1-SLIDES",
     "locator": "slide 2",
     "tag": "[T1:DEMO-1-1-SLIDES:slide 2]"
    }
   ],
   "confidence": "high",
   "proposed_selection": [
    "o1"
   ]
  },
  {
   "item_id": "p4-41",
   "status": "skipped",
   "skip_reason": "user-excluded"
  },
  {
   "item_id": "p4-42",
   "status": "skipped",
   "skip_reason": "user-excluded"
  },
  {
   "item_id": "p4-43",
   "status": "skipped",
   "skip_reason": "user-excluded"
  }
 ]
}
